place_id,name,formatted_address,lat,lng,types,rating,price_level
ChIJp9W3FakGdkgRR4vn-e5TNr8,"St Luke's C of E Primary School, Norwood","Linton Grove, Norwood, London SE27 0DZ, United Kingdom",51.4269411,-0.0998196,,4,0
ChIJafADW6AGdkgRAcEx63ajTas,Julian's Primary School - West Norwood site,"16 Wolfington Rd, Norwood, London SE27 0JF, United Kingdom",51.4312003,-0.1054614,,4.3,0
ChIJ85LWZ1QBdkgRMn-odnhjSaY,Kingswood Primary School (Upper Site),"Gipsy Rd, Norwood, London SE27 9RD, United Kingdom",51.4269176,-0.0898033,,4.1,0
ChIJS0k3TKAGdkgRMcVAlwGsBIs,Julian's Primary School Streatham,"226 Leigham Ct Rd, London SW16 2RB, United Kingdom",51.428542,-0.1151073,,4.8,0
ChIJE9AD2a0GdkgR3V5gT-AqcQM,Saint Joseph's Infant and Nursery School,"75 Crown Dl, London SE19 3NY, United Kingdom",51.4224308,-0.09917669999999999,,4.6,0
ChIJuzGucRcEdkgRocaf2THJgB4,Fenstanton Primary School,"Abbots Park, London SW2 3PW, United Kingdom",51.4426396,-0.11364,,4,0
ChIJPzbp6P8DdkgR6EJzSChI_6w,Elm Wood Primary School,"Carnac St, Norwood, London SE27 9RR, United Kingdom",51.4319475,-0.0919594,,4.3,0
ChIJG3lzzBgEdkgRvAXQg6nqUaU,Hitherfield Primary School & Children's Centre,"Leigham Vale, London SW16 2JQ, United Kingdom",51.4361648,-0.1151496,,4.8,0
ChIJF9GkelgBdkgR0oX6huh_a2s,Dulwich Wood Primary,"London SE21 8NX, United Kingdom",51.4321937,-0.08298799999999999,,4.1,0
ChIJrZPUZKQGdkgRlkVVKWhU7kw,Crown Lane Primary School and Children’s Centre,"Crown Ln, Norwood, London SW16 3HX, United Kingdom",51.4232786,-0.1092019,,4.7,0
ChIJvTBqPhgEdkgRPFNuZmbl0ZU,Streatham Wells Primary School,"50 Palace Rd, London SW2 3NJ, United Kingdom",51.4398835,-0.1160745,,4.8,0
ChIJ72X2k1oBdkgRf-EJIY5R-rU,Paxton Primary School,"Woodland Rd, Norwood, London SE19 1PA, United Kingdom",51.42224770000001,-0.08129829999999999,,4.6,0
ChIJ12cc12oEdkgRz6o2OZONsHg,Jubilee Primary School,"London SW2 2JE, United Kingdom",51.4523562,-0.1142933,,4,0
ChIJ1fu2vTkEdkgRtpHIZ6i74bs,Richard Atkins Primary School,"New Park Rd, Brixton Hill, London SW2 4JP, United Kingdom",51.44801229999999,-0.1263218,,5,0
ChIJUSlfWzwEdkgRLw8G1yipfLo,Orchard Primary School,"Christchurch Rd, Brixton Hill, London SW2 3ES, United Kingdom",51.4451073,-0.1223048,,3.7,0
ChIJnbC2FEEEdkgRJG5aSNQTsy8,Corpus Christi Primary School,"40 Trent Rd, Brixton Hill, London SW2 5BL, United Kingdom",51.4559536,-0.1201448,,5,0
ChIJgUlNLoMEdkgRRAiQbBGwoZw,"John Ruskin Primary School, Southwark","John Ruskin St, London SE5 0PQ, United Kingdom",51.4831515,-0.09686439999999999,,4.5,0
ChIJG51oxYMDdkgRl0qEhz-uhZo,Lyndhurst Primary School,"80 Grove Ln, London SE5 8SN, United Kingdom",51.470187,-0.0880522,,4.9,0
ChIJU2O3p34DdkgRLhYK0V7mi-Y,Brunswick Park Primary School,"Picton St, London SE5 7QH, United Kingdom",51.4780193,-0.0881117,,3.7,0
ChIJ-e1Yk38EdkgR3XjFDfEzFKk,Crawford Primary School,"Crawford Rd, London SE5 9NF, United Kingdom",51.4721696,-0.0952527,,4,0
ChIJ3Xr1RXoDdkgRd2_Lzhs0YnY,St George's C of E Primary School,"Coleman Rd, London SE5 7TF, United Kingdom",51.48023,-0.0843351,,4.5,0
ChIJf1hmf24DdkgRc3LoaJJ-vro,Cobourg Primary School,"Cobourg Rd, London SE5 0JD, United Kingdom",51.4848808,-0.0766934,,4.9,0
ChIJrcLnt3cDdkgRON0d7Ys5bqQ,Oliver Goldsmith Primary School,"83 Peckham Rd, London SE5 8UH, United Kingdom",51.4743473,-0.07801029999999999,,4.8,0
ChIJWwkcuI4DdkgRu9URHFYnuU0,Bessemer Grange Primary School,"London SE5 8HP, United Kingdom",51.4582698,-0.08791929999999999,,3.5,0
ChIJD6_zeoEEdkgR4rZc-E5WQw8,Comber Grove Primary School,"1-3 Comber Grove, London SE5 0LQ, United Kingdom",51.4776505,-0.0970872,,4.5,0
ChIJyV1d0IUEdkgRP6sYq1Lir80,"St John the Divine C of E Primary School, Camberwell","Warham St, Camberwell New Rd, London SE5 0SX, United Kingdom",51.4789134,-0.1035045,,3.5,0
ChIJH3cvsVAbdkgRF7WI-2tvZDs,Dallington School,"8 Dallington St, London EC1V 0BW, United Kingdom",51.5245955,-0.1004633,,3.7,0
ChIJWcTmCnUDdkgRNmDfawEBFes,St James the Great R C Primary School,"The School House Saint James the Gr, Peckham Rd, London SE15 5LP, United Kingdom",51.4743407,-0.07314559999999999,,4,0
ChIJgUc0AqwDdkgRaBKZ0q4ymjQ,Hollydale Primary School,"Hollydale primary school, Hollydale Rd, London SE15 2AR, United Kingdom",51.4676228,-0.0526331,,2.3,0
ChIJhReOxAADdkgRjUrHQUH9heE,Kender Primary School,"Kender Primary School, Kender St, London SE14 5JA, United Kingdom",51.4752743,-0.05105759999999999,,4.5,0
ChIJQen5hacDdkgRfujb7XHLY6Y,John Donne Primary School,"Wood's Rd, London SE15 2SW, United Kingdom",51.4731878,-0.0617412,,4.6,0
ChIJaQtN8tEPdkgRJbeoqwVvIFs,"St Stephen's Primary School, South Lambeth","Dorset Rd, London SW8 1EJ, United Kingdom",51.4796308,-0.1220941,,4.1,0
ChIJz8TPWRcDdkgRHJYoqQa25qE,Southwark Park Primary School,"383 Southwark Park Rd., London SE16 2JH, United Kingdom",51.49409259999999,-0.05802069999999999,,4.6,0
ChIJwYiUBzwDdkgRR0kjehDiImk,Riverside Primary School,"Janeway St, London SE16 4PS, United Kingdom",51.499573,-0.0651499,,4.7,0
ChIJ8dmer_EEdkgRnKiVyMNGSv8,Wyvil Primary School,"Wyvil Primary School, S Lambeth Rd, London SW8 2TJ, United Kingdom",51.4814958,-0.1251556,,4.9,0
ChIJN6VflV8DdkgRh-zfTVWGfqs,Ark Globe Academy,"Harper Rd, London SE1 6AF, United Kingdom",51.495337,-0.092406,,3.4,0
ChIJGSC7FTwEdkgRMZ0I5FhYHIA,Christ Church (Streatham) Church of England Primary School,"Cotherstone Rd, Brixton Hill, London SW2 3NF, United Kingdom",51.4450066,-0.1217797,,5,0
ChIJFZOjzkMEdkgRlw2utLuRyto,Sudbourne Primary School,"Hayter Rd, Brixton Hill, London SW2 5AP, United Kingdom",51.45805319999999,-0.1200556,,4.6,0
ChIJSxtscz4EdkgR7zgZegRhMPA,"Holy Trinity C of E Primary School, Upper Tulse Hill","Upper Tulse Hill, London SW2 2RL, United Kingdom",51.4474445,-0.1194092,,4.4,0
ChIJ9db1e3IEdkgRGEW89zJbpiQ,St Judes C.E. Primary School,"St. Judes C of E Primary School, Regent Rd, London SE24 0EL, United Kingdom",51.4543151,-0.1049806,,4.2,0
ChIJOde1s0gEdkgRDXruuaLikT4,Kings Avenue School,"Kings Ave, London SW4 8BQ, United Kingdom",51.4568729,-0.1295048,,3.5,0
ChIJ4QLD1XwEdkgRIQGidGvGNIU,Loughborough Primary School,"44 Minet Rd, London SW9 7UA, United Kingdom",51.4697972,-0.1047799,,4.4,0
ChIJkYsTykoEdkgRLpq64Um7szg,Bonneville Primary School,"Bonneville Gardens, London SW4 9LB, United Kingdom",51.452808,-0.139334,,4.2,0
ChIJG0s4_lIEdkgRfSKWjcmtPBI,Clapham Manor Primary School,"Belmont Rd, London SW4 0BZ, United Kingdom",51.4646538,-0.1375128,,4.8,0
ChIJRaVT80gEdkgR4AGe7mG6xH0,Iqra VA Primary School,"127 Park Hill, London SW4 9PA, United Kingdom",51.4550637,-0.1301479,,4.1,0
ChIJe2XwdVgEdkgRVl7k4RbR36E,Allen Edwards Primary School,"Studley Rd, London SW4 6RP, United Kingdom",51.4728698,-0.1269949,,4.5,0
ChIJwxVUAqsFdkgRM7gl4efARGE,Heathbrook Primary School,"1A St Rule St, Nine Elms, London SW8 3EH, United Kingdom",51.4702195,-0.1432526,,4.6,0
ChIJj3N1lK8FdkgRNPs5u2jN4SI,Belleville Wix Academy,"Wix's Ln, London SW4 0AJ, United Kingdom",51.463842,-0.15144,,4.2,0
ChIJqfEuwgkFdkgRtuWw3TZpPXU,Chesterton Primary School,"Dagnall St, London SW11 5DT, United Kingdom",51.473673,-0.1566157,,4,0
ChIJJcrQaF4EdkgRt7v0vnMd1Rk,Stockwell Primary School and Children's Centre,"Stockwell Rd, London SW9 9TG, United Kingdom",51.4667228,-0.1181829,,4.4,0
ChIJG-QTUr4FdkgRFnos_oWxnfE,Honeywell Infant & Junior Schools,"Honeywell Rd, London SW11 6EF, United Kingdom",51.4544852,-0.1626028,,5,0
ChIJDRVF_JUFdkgRAqA5HKSw8G0,Belleville Primary School,"Belleville Road, Belleville Rd, London SW11 6PR, United Kingdom",51.4572294,-0.163863,,4.2,0
ChIJaWyKlKYFdkgRZmMd46ztGio,Shaftesbury Park Primary School,"Ashbury Rd, London SW11 5UW, United Kingdom",51.4685942,-0.1571674,,4,0
ChIJUQmPxkwDdkgRAKRROlsIQ9k,The Aldgate School,"St James' Passage, Duke's Place, London EC3A 5DE, United Kingdom",51.5135319,-0.0775537,,4.7,0
ChIJUSAmjG8EdkgRxMkJFsUOCTg,Hill Mead Primary School,"Moorland Rd, London SW9 8UE, United Kingdom",51.4619185,-0.1067988,,4.4,0
ChIJE9gsXZI0cEERmMYTRo7ddp8,St John's Angell Town Primary School,"85 Angell Rd, London SW9 7HH, United Kingdom",51.4678487,-0.1083824,,4.3,0
ChIJYYyPzNoDdkgRPn_uNR3aZ2I,St Saviour's C of E Primary School,"69 Herne Hill Rd, London SE24 0AY, United Kingdom",51.4634845,-0.09823319999999999,,4.9,0
ChIJx-CQ0nAEdkgR8onkUdbbOvU,Jessop Primary School,"Lowden Rd, London SE24 0BJ, United Kingdom",51.4600218,-0.100999,,3.9,0
ChIJQ4s39TIEdkgRpDLHaqbIIc8,Telferscot Primary School,"Telferscot Rd, London SW12 0HW, United Kingdom",51.44328489999999,-0.1370863,,4,0
ChIJ4Yz3cYsEdkgR79lRRqxsCiQ,Reay Primary School,"Hackford Rd, Vassal, London SW9 0EN, United Kingdom",51.4776095,-0.1148625,,4.5,0
ChIJ3ahDkcgFdkgRe0GNoJ-tTjY,Alderbrook Primary School,"Oldridge Rd, London SW12 8PP, United Kingdom",51.4485411,-0.149858,,5,0
ChIJKZtiov8EdkgR9ZQ877SyujQ,Griffin Primary School,"Stewart's Rd, Nine Elms, London SW8 4JB, United Kingdom",51.47424239999999,-0.138421,,3.6,0
ChIJOz2Wd1cEdkgRyPX4Elhz2ss,Lark Hall Primary School,"Smedley St, London SW4 6PH, United Kingdom",51.47053769999999,-0.1292803,,3.7,0
ChIJ1wgW72oFdkgR130xYCq0Bi4,Marlborough Primary School,"Marlborough Primary School, Draycott Ave, London SW3 3AP, United Kingdom",51.4929012,-0.1659446,,4.6,0
ChIJsdVi6XoFdkgRwYwNR4SwQuo,Ashburnham Community Primary School,"17 Blantyre St, London SW10 0DT, United Kingdom",51.48158309999999,-0.1790615,,3.4,0
ChIJadrOmJ0GdkgRCW103ADey64,Sunnyhill Primary School,"Sunnyhill Rd, London SW16 2UW, United Kingdom",51.4291041,-0.1204015,,4.8,0
ChIJTeB14doFdkgRhSkffSEksSE,Rutherford House School,"217 Balham High Rd, London SW17 7BQ, United Kingdom",51.4391069,-0.1556524,,4.3,0
ChIJVdfiKPEEdkgRSIVF10rXjgw,"Herbert Morrison Primary School, Stockwell","11 Hartington Rd, London SW8 2HP, United Kingdom",51.4785353,-0.1254798,,4.7,0
ChIJQVmpSY0EdkgR5BDGa2uQg3Q,Ashmole Primary School,"Ashmole St, London SW8 1NT, United Kingdom",51.4820029,-0.1149298,,3.9,0
ChIJD9arFP4EdkgR00PYWGlj1ys,"St Georges C of E Primary School, Nine Elms","Corunna Rd, Nine Elms, London SW8 4JS, United Kingdom",51.4771324,-0.138735,,4.9,0
ChIJM3iwul4EdkgRTnn9AciLiIo,"St Andrew's Church of England Primary School, Stockwell","Kay Rd, London SW9 9DE, United Kingdom",51.4687995,-0.1225273,,4.2,0
ChIJTWwFXpYEdkgRZGdYMDJ6484,Archbishop Sumner Church of England Primary School,"Reedworth St, London SE11 4PH, United Kingdom",51.49153399999999,-0.1097222,,3.9,0
ChIJYbY4byQddkgRqQN-r-udpes,London Fields Primary School,"Westgate St, London E8 3RL, United Kingdom",51.5379022,-0.0586663,,5,0
ChIJwRAXz5ADdkgRJaCTg2JayxQ,Goose Green Primary School,"Tintagel Cres, London SE22 8HG, United Kingdom",51.4615362,-0.0769843,,4,0
ChIJGxXWcAoGdkgRu7co_Un_JJY,Gatton Primary School,"13e Broadwater Rd, London SW17 0DS, United Kingdom",51.4306479,-0.1677772,,3.7,0
ChIJB1CnVsUFdkgRxuvLqgNRWPM,Ravenstone Primary School and Nursery,"Ravenstone St, London SW12 9SS, United Kingdom",51.4412498,-0.1531333,,4.6,0
ChIJQx-5a8ADdkgRU17STTQalxM,Goodrich Community Primary School,"Dunstans Rd, London SE22 0EP, United Kingdom",51.4501645,-0.0672236,,3.5,0
ChIJ3zF-_hIDdkgRhCjdfyZj_JU,Phoenix Primary School,"Marlborough Grove, London SE1 5JT, United Kingdom",51.4875334,-0.0674053,,3.8,0
ChIJ7YycBKcEdkgRcCZPkt6e7gM,Charles Dickens Primary School,"Toulmin St, London SE1 1AF, United Kingdom",51.5013155,-0.0964544,,4.9,0
ChIJV5xTy0IDdkgRgkQ9rj8LsLc,Grange Primary School,"Webb St, London SE1 4RP, United Kingdom",51.4957217,-0.08225589999999999,,3.9,0
ChIJCxBECVgDdkgR18LBvfN86s8,The Cathedral School of St Saviour & St Mary Overy,"Redcross Way, London SE1 1HG, United Kingdom",51.5027487,-0.0942441,,4.2,0
ChIJtVFJ6soEdkgRFa3NDt6VCiE,St Clement Danes Church of England Primary School,"St Clement Danes School, 118 Drury Ln, London WC2B 5SU, United Kingdom",51.513462,-0.1192726,,4,0
ChIJBbFTZo0EdkgRxvzPcKjhwFU,Saint Mark's Church of England Primary and Nursery School,"Harleyford Rd, London SE11 5SL, United Kingdom",51.4843261,-0.1171978,,4.8,0
ChIJsWV9yYkFdkgRwEj0Si1yLSo,St Faith's C of E Primary School,"Alma Road, East Hill, London SW18 1AE, United Kingdom",51.459697,-0.1872635,,3.9,0
ChIJWb3eEt8FdkgRUDYQBoCedrw,Hillbrook Primary School,"Hillbrook Rd, London SW17 8SG, United Kingdom",51.43083129999999,-0.1587116,,4.4,0
ChIJObLegJoEdkgRf4HRxq7jEfE,Keyworth Primary School,"Faunce St, London SE17 3TR, United Kingdom",51.48641070000001,-0.1046171,,3.2,0
ChIJp6X6bRUFdkgRIUKaOtLNeH4,Saint Joseph's Catholic Primary School,"47 Cadogan St, London SW3 2QJ, United Kingdom",51.4930459,-0.1622848,,4.4,0
ChIJ_ekn-xUFdkgR74IDsNWfWvo,Holy Trinity Church of England Primary School - Cadogan Gardens Infant Site,"1 Cadogan Gardens, London SW3 2RN, United Kingdom",51.4932407,-0.1588071,,5,0
ChIJs24A9JEEdkgRgmh85ekZ9YU,Henry Fawcett Primary School,"Bowling Green St, London SE11 5BZ, United Kingdom",51.4842049,-0.1123592,,4.5,0
ChIJjYEOi48PdkgRjFO9RvSWPD0,Fulham Primary School,"Halford Rd, London SW6 1JU, United Kingdom",51.4835806,-0.198399,,3.9,0
ChIJQ0sptfQGdkgRrKyJt4nSsKM,Stanford Primary School,"Chilmark Rd, London SW16 5HB, United Kingdom",51.4096394,-0.1346678,,2.8,0
ChIJLyp-xpQDdkgRWohRnt2YyDM,Heber Primary School,"Heber Rd, London SE22 9LA, United Kingdom",51.4530028,-0.0736658,,4.7,0
ChIJG3Te4wIGdkgRXetISy74Ark,Garfield Primary School,"Garfield Rd, London SW19 8SB, United Kingdom",51.4233071,-0.1852762,,3.4,0
ChIJm9XbyiMBdkgR5pJz3AcTejg,South Norwood Primary School,"34 Crowther Rd, London SE25 5QP, United Kingdom",51.39555,-0.0733754,,4.6,0
ChIJn6SLNZMEdkgRdVJHZXkenPI,Vauxhall Primary School,"Vauxhall St, London SE11 5LG, United Kingdom",51.4888187,-0.1176882,,3.6,0
ChIJCXTAwXYFdkgRiw-B6OFV0UA,Westbridge Academy,"6 Bolingbroke Walk, London SW11 3NE, United Kingdom",51.4771004,-0.1718766,,4.3,0
ChIJsds2Ea4FdkgRSkl6SJRIW14,Macaulay Primary School,"Victoria Rise, London SW4 0NU, United Kingdom",51.4638216,-0.1474486,,4.7,0
ChIJiQyJKpkFdkgR0rsrcrRWKBg,John Burns Primary School,"21 Wycliffe Rd, London SW11 5QR, United Kingdom",51.4690868,-0.1529888,,4.1,0
ChIJH4jRwlgDdkgRx32M4zK8Sxs,London Christian School,"40 Tabard St, London SE1 4JU, United Kingdom",51.5003129,-0.0915115,,4.1,0
ChIJu4cQt2YDdkgR9c6cE-TnoKI,"English Martyrs RC Primary School, Walworth","Flint St, London SE17 1QD, United Kingdom",51.4905261,-0.08778079999999999,,3.6,0
ChIJNdmqIL4EdkgRmVJ4q-CMwso,Walnut Tree Walk Primary School,"Walnut Tree Walk, London SE11 6DS, United Kingdom",51.49366699999999,-0.1139153,,4.7,0
ChIJ25NijJwEdkgR6b4i2Mga5LI,"St Paul's Primary School, Walworth","Penrose St, London SE17 3DT, United Kingdom",51.4864311,-0.099294,,4.1,0
ChIJvW-6V0UPdkgR7fgPTFEeOWE,Anglo Portuguese School of London,"25 Courthouse Way, London SW18 4QG, United Kingdom",51.4561138,-0.1909531,,0,0
ChIJWaA6CGYDdkgRT5p-iznq5Mg,Surrey Square Primary School,"Surrey Square, London SE17 2JY, United Kingdom",51.4888245,-0.0830664,,4.9,0
ChIJU8h2RJkEdkgRbAH0np0fcYc,Crampton Primary School,"23 A Iliffe St, London SE17 3QA, United Kingdom",51.4898779,-0.100866,,3.6,0
ChIJdejPBIkEdkgRyUTf4dHRnbc,Christ Church SW9 Primary,"Cancell Rd, Vassal, London SW9 6HN, United Kingdom",51.4761616,-0.108612,,4.4,0
ChIJBSDq7ooEdkgR93NLxG26RYk,Van Gogh Primary (Junior),"Hackford Rd, Vassal, London SW9 0RD, United Kingdom",51.4748605,-0.115553,,3.6,0
ChIJ9eKP6jQDdkgRePdFjhbVOfw,Harry Gosling Primary School,"Fairclough St, London E1 1NT, United Kingdom",51.5138034,-0.0660761,,4.1,0
ChIJNUZ5pCYDdkgRevx7GsVJcUk,Albion Primary School,"Albion St, London SE16 7JD, United Kingdom",51.4997395,-0.0514967,,3.2,0
ChIJf4PW7hoDdkgRW-wvpqtPeEo,Ilderton Primary School,"Varcoe Rd, London SE16 3LA, United Kingdom",51.4851383,-0.0543225,,4.4,0
ChIJDUbuESIDdkgRpUjm6WLZmj4,"St Joseph's Catholic Primary School, Southwark","Gomm Rd, London SE16 2TY, United Kingdom",51.4956132,-0.0527884,,4.7,0
ChIJy6m6LtkCdkgRlnqJM_5wD8A,Alfred Salter Primary School,"Quebec Way, London SE16 7LP, United Kingdom",51.4997066,-0.0438394,,3.8,0
ChIJT7332mQFdkgRpSK5QF2kIcU,Park Walk Primary School,"Park Walk, London SW10 0AY, United Kingdom",51.4838745,-0.1773924,,3.2,0
ChIJGTGaGmMFdkgRSzj3JGHEXi0,Servite RC Primary School,"252 Fulham Rd., London SW10 9NA, United Kingdom",51.4850624,-0.1839596,,5,0
ChIJRWdf_8oPdkgRI8YqomqhHEo,West London Free School Primary,"Cambridge Grove, London W6 0LB, United Kingdom",51.4952102,-0.231344,,4.4,0
ChIJRTSugOwPdkgRivyXjGqy1fM,Kensington Primary Academy School,"205 Warwick Rd, London W14 8PU, United Kingdom",51.4962767,-0.2051847,,4.7,0
ChIJbzptgcsPdkgROTmIV39c-Bk,Brackenbury Primary School Learning and education,"Dalling Rd, London W6 0BA, United Kingdom",51.49982869999999,-0.2327751,,3.3,0
ChIJ63KgEuIPdkgRBIG79GJAk7A,Colville Primary School,"Lonsdale Rd, London W11 2DF, United Kingdom",51.5149321,-0.2032445,,4.5,0
ChIJOfyB2hkFdkgRZEHroVL9YfI,St Barnabas Primary School,"St Barnabas St, London SW1W 8PF, United Kingdom",51.4906236,-0.1518876,,4.4,0
ChIJrznGLSIFdkgRLkCWzSS5k_U,St Peter's Eaton Square C of E School,"Lower Belgrave St, London SW1W 0NL, United Kingdom",51.4961059,-0.1468045,,4.6,0
ChIJv3QyQVUFdkgRYEIUd1HBZZE,Hallfield Primary School,"School House, Porchester Gardens, Hallfield Estate, London W2 6JJ, United Kingdom",51.5159935,-0.1862246,,4.5,0
ChIJU0_J0ssadkgRpacamjygM_8,ICS London - Wyndham Place,"7B Wyndham Pl, London W1H 1PN, United Kingdom",51.5196453,-0.1613939,,3.9,0
ChIJ7a5dl_wPdkgRGC6qm5uDpCY,Southbank International School Kensington,"36-38 Kensington Park Rd, London W11 3BU, United Kingdom",51.510265,-0.1980284,,4.3,0
ChIJsV9BcWcFdkgR9b8BSMHzXpA,Our Lady of Victories Roman Catholic Primary School,"Our Lady of Victories Rc Primary School, 8 Clareville St, South Kensington, London SW7 5AQ, United Kingdom",51.4928395,-0.1794249,,3.2,0
ChIJ77QKOAkEdkgRWDOmQ7fHq7U,Rosendale Primary School,"Rosendale Rd, Norwood, London SE21 8LR, United Kingdom",51.4465023,-0.09894549999999999,,4.1,0
ChIJSfQJfWIDdkgRsOX758mbfAw,St Peter's Primary School,"Liverpool Grove, London SE17 2HH, United Kingdom",51.48690449999999,-0.0917795,,4.5,0
ChIJMYeDWQwDdkgRGJH6GWBpPkk,"St Francis Catholic Primary School, Peckham","Friary Rd, London SE15 1QR, United Kingdom",51.4801888,-0.0668462,,4.6,0
ChIJpWHfoGMDdkgR6_FHRh_q9Vs,Michael Faraday Primary School,"Portland St, London SE17 2HR, United Kingdom",51.484991,-0.08869289999999999,,4.7,0
ChIJB3a8wnUDdkgRsQEcw6DUQ_8,Harris Primary Free School Peckham,"112 Peckham Rd, London SE15 5DZ, United Kingdom",51.47330420000001,-0.0734532,,3,0
ChIJz6JpwMgQdkgRG_ZG4jpF1zY,Nancy Reuben Primary Independent ISA School for Boys and Girls aged 2-11 Est 1999. Orthodox Jewish Primary School in Hendon London.,"48 Finchley Ln, London NW4 1DJ, United Kingdom",51.5895516,-0.2183933,,5,0
ChIJbRjqZlkDdkgRdT480Q0KVoI,Beormund Primary School,"Crosby Row, London SE1 3PS, United Kingdom",51.5008333,-0.0884944,,3.4,0
ChIJO4UjSUQDdkgRWAmkeBfw3cI,Tower Bridge Primary School,"Fair St, London SE1 2AE, United Kingdom",51.5015551,-0.07723239999999999,,4,0
ChIJt3nx_EEDdkgRpTFJO1kwYhA,Boutcher Church of England Primary School,"93 Grange Rd, London SE1 3BW, United Kingdom",51.494038,-0.0754488,,4.8,0
ChIJPVo041oDdkgRqMWizDaNthU,Snowsfields Primary School,"Kirby Grove, London SE1 3TD, United Kingdom",51.5016326,-0.0840221,,3.2,0
ChIJkbbMEoADdkgRyi2nuBb1ihA,"Nursery and Pre-School at Ilderton - Bermondsey, Southwark, Rotherhithe","Varcoe Rd, London SE16 3LA, United Kingdom",51.4851178,-0.0544606,,0,0
ChIJ1znIC2cDdkgRKetRH0eSbXQ,Townsend Primary School,"Townsend St, London SE17 1HJ, United Kingdom",51.4923371,-0.0850045,,3.7,0
ChIJTwmN5GEDdkgRepJzfbOE8wQ,Robert Browning Primary School,"89 East St, London SE17 2DH, United Kingdom",51.4889624,-0.0927194,,3.5,0
ChIJnwlGe7kEdkgRciRpgjKbFUw,Oasis Academy Johanna,"Johanna St, Lower Marsh, London SE1 7RH, United Kingdom",51.5008263,-0.1113632,,3.4,0
ChIJpVDHktscdkgREW8B4_lvim0,St John's C Of E Primary School,"Peel Grove, Bethnal Green, London E2 9LR, United Kingdom",51.5300373,-0.0543481,,4.5,0
ChIJt3JQlEIFdkgRZ3KBkY0hfJk,Connections,"2 Cromwell Pl, South Kensington, London SW7 2JE, United Kingdom",51.4949634,-0.1745806,,0,0
ChIJGRhQHPcPdkgRvMQry1K3hwo,St Mary Abbots Primary School,"2 Kensington Church Ct, London W8 4SP, United Kingdom",51.501998,-0.1923282,,5,0
ChIJwVao62EFdkgRKPE32EWJun8,Bousfield Primary School,"S Bolton Gardens, London SW5 0DJ, United Kingdom",51.49022369999999,-0.1860951,,4.4,0
ChIJQ52Sc4sFdkgRhOwvriPWSwU,Wandsworth Preparatory School,"2 Allfarthing Ln, London SW18 2PQ, United Kingdom",51.4542394,-0.1827032,,4,0
ChIJj2RUHVMFdkgRJ1ikm9E9hj0,St. James & St. John CofE Primary School,"4 Craven Terrace, London W2 3QD, United Kingdom",51.5130782,-0.179321,,5,0
ChIJE1tEncoadkgR487IxtZNCiI,Hampden Gurney C Of E Primary School,"13 Nutford Pl, London W1H 5HA, United Kingdom",51.516741,-0.1642818,,4,0
ChIJFf2I6dgDdkgRY664KQujaS0,Kelvin Grove Primary School,"Kelvin Grove, London SE26 6BB, United Kingdom",51.4327262,-0.06227340000000001,,4.7,0
ChIJi7lsUXwGdkgRWoBls2BLYv4,Penwortham Primary School,"Penwortham Rd, London SW16 6RJ, United Kingdom",51.4220732,-0.1467876,,4.4,0
ChIJoyP-dUkBdkgRUZ945O7JczU,All Saints Primary School,"Upper Beulah Hill, London SE19 3LG, United Kingdom",51.41241170000001,-0.0870517,,4.1,0
ChIJLTWMF00BdkgR83uSVsv8bYQ,Rockmount Primary School,"Chevening Rd, London SE19 3ST, United Kingdom",51.4184859,-0.0920346,,4.7,0
ChIJgSmBvmoBdkgR5LcKoYd4I30,James Dixon Primary School,"William Booth Rd, Anerley, London SE20 8BW, United Kingdom",51.4116758,-0.06864980000000001,,4.5,0
ChIJG4OgczcBdkgRfawDAfLtpOQ,Cypress Primary School - Upper School site,"32 Cypress Rd, London SE25 4AU, United Kingdom",51.4066124,-0.0828223,,3.4,0
ChIJrUf52bYGdkgRQsCVXyYM58w,Downsview Primary School,"Biggin Way, London SE19 3XE, United Kingdom",51.4154126,-0.1019242,,4.4,0
ChIJS28iI24BdkgR8rITmmF_ydQ,Harris Primary Academy Crystal Palace,"Malcolm Rd, London SE20 8RH, United Kingdom",51.4163909,-0.0588279,,4.1,0
ChIJVzfi6UkEdkgR3Ma09ANJeyo,Glenbrook Primary School,"Clarence Cres, London SW4 8LD, United Kingdom",51.4526861,-0.1332711,,3.6,0
ChIJ47eA_lAPdkgRdmjEdoAPDEY,Wimbledon Park Primary School,"Havana Rd, London SW19 8EJ, United Kingdom",51.438123,-0.195429,,4.5,0
ChIJY2ue6aQEdkgRu7jDM_7uoMM,Friars Primary School,"Webber St, London SE1 0RF, United Kingdom",51.5012859,-0.1031618,,5,0
ChIJ3wlUtQYFdkgR47tcWjVNvcQ,Wandsworth SCITT,"7 St Joseph's St, Nine Elms, London SW8 4EN, United Kingdom",51.4768385,-0.1466679,,0,0
ChIJHxeDKuQEdkgRkjaPg8jArAM,Westminster Cathedral R C Primary School,"Bessborough Pl, Pimlico, London SW1V 3SE, United Kingdom",51.4886547,-0.1323582,,5,0
ChIJj3N1lK8FdkgRF3HhQOgIItQ,Lycee Francais Wix School,"Wix's Ln, London SW4 0AJ, United Kingdom",51.46405499999999,-0.151465,,5,0
ChIJxYrkWDYCdkgRt6qZBZGPOoo,Stillness Infant School,"Brockley Rise, London SE23 1NH, United Kingdom",51.4496214,-0.0389403,,4,0
ChIJJYDK0hIFdkgRIPbwjobSVH4,Christ Church C of E Primary School,"1 Robinson St, London SW3 4AA, United Kingdom",51.4854256,-0.1642924,,5,0
ChIJX1L4e2kFdkgRcEqCRpqQXQ0,Oratory Roman Catholic Primary School,"Bury Walk, Cale St, London SW3 6QH, United Kingdom",51.4904344,-0.1701222,,3,0
ChIJBSFRZkwOdkgRbDciJKyTHdI,St Paul's School,"Lonsdale Rd, London SW13 9JT, United Kingdom",51.4880878,-0.2373996,,4.1,0
ChIJsduBIxYFdkgR2e0MDwi_1hk,Holy Trinity C of E Primary School,"1 Sedding St, London SW1X 9DE, United Kingdom",51.493399,-0.1567529,,3.7,0
ChIJW5sAe5cPdkgRIrDSel7vV38,Sir John Lillie Primary School,"245 Lillie Rd, London SW6 7LN, United Kingdom",51.4831314,-0.2096914,,4,0
ChIJWzJCnBUDdkgRMuHQyBlcv5A,St. James' CE Primary School,"Alexis St, London SE16 3XZ, United Kingdom",51.4930864,-0.06717769999999999,,0,0
ChIJHRd6PTEddkgRLrtP8VRQSco,Bonner Primary School - Mile End Site,"2c Ropery St, Bow, London E3 4QE, United Kingdom",51.5219232,-0.0325287,,4.4,0
ChIJu0m3RQ0NdkgRQwR3_y5vYZI,Hounslow Town Primary School,"School Rd, London TW3 1QZ, United Kingdom",51.4692656,-0.3562884,,0,0
ChIJB54DVZ4bdkgRY0ngw1DAK58,Pakeman Primary School,"Hornsey Road, Holloway, London, United Kingdom, N7 6DU, London N7 6QN, United Kingdom",51.5587844,-0.1139939,,4.6,0
ChIJiVzTtjgDdkgRPCbZph6toRY,St Joseph's R C Primary School,"George Row, London SE16 4UP, United Kingdom",51.49962739999999,-0.0695162,,4.6,0
ChIJRcj--MwFdkgR8MRJVQ4UyCE,Henry Cavendish Primary School,"Hydethorpe Rd, London SW12 0JA, United Kingdom",51.4442933,-0.1435287,,3.8,0
ChIJMzvJwZAZdkgRpJPjnyYTqmc,Dwight School London - Spahn Building (Upper School),"Friern Barnet Rd, London N11 3DR, United Kingdom",51.613572,-0.154756,,3.9,0
ChIJuyp5tcECdkgRHYFTHp5EAzg,Arnhem Wharf Primary School,"1 Arnhem Pl, London E14 3RP, United Kingdom",51.49542539999999,-0.0264144,,3.7,0
ChIJXUGv7WEPdkgRApmuuosVMVs,"St Anne's Church of England School, Wandsworth","208 St Ann's Hill, London SW18 2RU, United Kingdom",51.4561907,-0.1892682,,4,0
ChIJA_JG1AYCdkgRUgnVHOM-880,Torridon Primary School,"Hazelbank Rd, London SE6 1TG, United Kingdom",51.43649910000001,-0.0014813,,4.2,0
ChIJXVZreqgedkgR2NBrb0rtUcw,Risley Avenue Primary School,"The Roundway, London N17 7AB, United Kingdom",51.5999199,-0.078655,,4.6,0
ChIJAbsZ4KoDdkgRg3KwuiDKClU,Edmund Waller Primary School,"Waller Rd, London SE14 5LY, United Kingdom",51.4710568,-0.0485293,,5,0
ChIJIdOv2MQFdkgRaxngNHfSy8U,"Trinity St. Mary's CE Primary School, Balham","6 Balham Park Rd, London SW12 8DR, United Kingdom",51.4425835,-0.1550641,,4.8,0
ChIJewZkjfYOdkgRkot61sscNL0,Barnes Primary School,"Cross Street, London SW13 0QQ, United Kingdom",51.4684558,-0.2508309,,4.8,0
ChIJGyshow0SdkgRTf0F5IDljN0,Montpelier Primary School,"Montpelier Rd, London W5 2QT, United Kingdom",51.5234775,-0.3034433,,4.5,0
ChIJPbHlHmYPdkgRUufHjs-yxzw,West Hill Primary School,"5 Merton Rd, London SW18 5ST, United Kingdom",51.456051,-0.1990809,,4.9,0
ChIJ0fDteP0FdkgRGlbVOgCUU1w,Smallwood Primary School & Language Unit,"Smallwood Rd, London SW17 0TN, United Kingdom",51.4305925,-0.1794183,,3.8,0
