place_id,name,formatted_address,lat,lng,types,rating,price_level
ChIJb9PCkkEEdkgRDyzsGW5XdIg,Lambeth College - Brixton Centre,"56 Brixton Hill, London SW2 1QS, United Kingdom",51.4564172,-0.1189836,,4,0
ChIJn4GUxTUFdkgRO-ZWAZ00KpY,Learnforth University,"Salford Rd, London WC2N 5DU, United Kingdom",51.4415703,-0.1336639,,5,0
ChIJQ04_S2QFdkgRq54qSvOo6U0,Harris Academy,"73 Kings Ave, Brixton Hill, London SW4 8DX, United Kingdom",51.4555432,-0.12883,,0,0
ChIJt4xTRyYFdkgRMoQF-GvBHYI,University,"University of wales trinity said david, United Kingdom",51.4798647,-0.1092821,,0,0
ChIJldb7OqAEdkgR5FfD5fcOr_8,London South Bank University,"103 Borough Rd, London SE1 0AA, United Kingdom",51.4978153,-0.1011675,,4,0
ChIJi5yzN7MFdkgRFlTdjpJcRpE,Lambeth College Clapham Centre,"45 Clapham Common South Side, London SW4 9BL, United Kingdom",51.4590914,-0.1413925,,3.3,0
ChIJb_etmQgGdkgRkXzg_R_ORJY,St George's University of London,"Cranmer Terrace, London SW17 0RE, United Kingdom",51.4269516,-0.1738811,,4.4,0
ChIJeTLpkroFdkgRTgLZl75eWM8,College,"London SW12 0NS, United Kingdom",51.4466818,-0.141161,,0,0
ChIJXWE4334EdkgRFePbClLHPII,"The James Black Centre, King's College London","Sir James Black Centre for Cell and Integrative Biology, 125 Coldharbour Ln, London SE5 9NU, United Kingdom",51.4687438,-0.09680169999999999,,3.5,0
ChIJ4dRmlrUEdkgRnui157UbBys,King's College London,"10 Cutcombe Rd, London SE5 9RJ, United Kingdom",51.4683751,-0.0960211,,4.7,0
ChIJoV_pI86k2EcRKeOLNMUvmhM,DLondon Vesta College,"14, Loin Yd, Tremadoc Rd, London SW4 7NQ, United Kingdom",51.4631657,-0.1317909,,0,0
ChIJ16jB4fgEdkgRY3W_xd6HrhE,Lambeth College UCU,"Belmore St, Wandsworth Rd, London SW8 2JY, United Kingdom",51.475708,-0.1329305,,2.3,0
ChIJ25cDy3gEdkgRZoDggIdHees,Clinical Research Wing,"129-131 Coldharbour Ln, London SE5 9NY, United Kingdom",51.4676549,-0.0952575,,5,0
ChIJ_bZd9H0EdkgRB4FOw5SP9l4,Borough College London,"61 Paulet Rd, Vassal, London SE5 9HW, United Kingdom",51.47180549999999,-0.1011125,,5,0
ChIJxzkMcYIDdkgR2WoxMhfGZvQ,University of the Arts Camberwell College of Arts,"1 Wilson Rd, London SE5 8LU, United Kingdom",51.472767,-0.0859414,,4.3,0
ChIJoYT6BS4bdkgRelGnuTI4IjU,University of London,"Senate House, Malet St, London WC1E 7HU, United Kingdom",51.5229378,-0.1308206,,4.5,0
ChIJxa6mYLcEdkgR5Hqd501sVOk,King's College London Waterloo Campus,"Stamford St, London SE1 9NH, United Kingdom",51.5058203,-0.1138156,,4.5,0
ChIJUQyDP5cEdkgRXarD212eM-A,IntoUniversity Kennington,"Keyworth Primary School, Faunce St, London SE17 3TR, United Kingdom",51.4863198,-0.1048368,,5,0
ChIJY1wp6pAEdkgRDc5yU51Y3iI,City & Guilds of London Art School,"124 Kennington Park Rd, London SE11 4DJ, United Kingdom",51.4872287,-0.1074457,,5,0
ChIJq7pf3Y4EdkgRe5cpX_uLg3Y,University of Wales Trinity St David - London,"Winchester House, 11 Cranmer Rd, Vassal, London SW9 6EJ, United Kingdom",51.479754,-0.1092749,,4.1,0
ChIJl1GgQpAEdkgR_H60vhkIFKc,The Park College,"5 Kennington Park Pl, London SE11 4AS, United Kingdom",51.4853878,-0.1069849,,5,0
ChIJS_Xam5gEdkgRNf6fOQt4nG4,London College of Communication,"Elephant and Castle, London SE1 6SB, United Kingdom",51.49479669999999,-0.101763,,3.7,0
ChIJf9rzAloDdkgR66eYrWsx1-I,King's College London Guy's Campus,"Guy's Campus, Great Maze Pond, London SE1 1UL, United Kingdom",51.5032678,-0.08779669999999999,,4.7,0
ChIJA_Hzo74EdkgRCwwT8jiIjjo,Oasis College,"1 Kennington Rd, London SE1 7QP, United Kingdom",51.4981404,-0.1118121,,0,0
ChIJt5KnarwEdkgRlI9f6DAf-rY,Morley College London - Waterloo Centre,"61 Westminster Bridge Rd, London SE1 7HT, United Kingdom",51.4980457,-0.1097722,,4.2,0
ChIJ9ZoFbaMEdkgR8ztQu2pJHFg,Students' Union,"120 London Rd, Elephant and Castle, London SE1 6LF, United Kingdom",51.4980041,-0.1034652,,0,0
ChIJG03LZ5AEdkgRn3OOiGhnd9M,The Park College,"5 Kennington Park Pl, London SE11 4AS, United Kingdom",51.4854591,-0.1068488,,5,0
ChIJnXfHb7UEdkgRn4inmQMJJgU,"Bush House East Wing, King's College London","44-46 Aldwych, London WC2B 4LL, United Kingdom",51.5131457,-0.1161784,,4.4,0
ChIJhw_TWhQFdkgRchd_soDTjjA,All In Actors,"Harleyford St, London SE11 5SY, United Kingdom",51.4823872,-0.1128696,,5,0
ChIJEzRNvaMEdkgREZeD3QrhQ8Q,K2 LSBU,"Keyworth St, London SE1 0AA, United Kingdom",51.4980775,-0.1020219,,4.5,0
ChIJs1qZrqMEdkgR8fLFOFdyO8k,The College of Contemporary Health,"90 London Rd, Elephant and Castle, London SE1 6LN, United Kingdom",51.496927,-0.102191,,0,0
ChIJw_OfvaMEdkgR90G1qBrtlE0,"Chinese Clinic, London South Bank University","K2, Building, Keyworth St, Elephant and Castle, London SE1 0AA, United Kingdom",51.4966014,-0.1018042,,0,0
ChIJ9XKpRuoEdkgRPEBdm--884k,London School of Business & IT,"09 Albert Embankment, London SE1 7SP, United Kingdom",51.492234,-0.1213434,,0,0
ChIJfZ17x6MEdkgREbeKIsPWkt4,Keyworth Arts and Media Centre,"Keyworth St, London SE1 6NG, United Kingdom",51.4974451,-0.1011626,,4.3,0
ChIJU_rWf2gBdkgR9pm7DYsXVvs,GLL College,"Crystal Palace National Sports Centre, Ledrington Road, London SE19 2BB, United Kingdom",51.41998299999999,-0.067816,,4.5,0
ChIJl_JW0WkBdkgRkv252jXPGRE,Capel Manor College,"Ledrington Rd, London SE19 2BS, United Kingdom",51.4188627,-0.0676929,,3.1,0
ChIJKdgvLTwEdkgRUzELxBFAtPk,Spirit Success Coaching,"1 Farquhar Rd, Norwood, London SE19 1SS, United Kingdom",51.42070769999999,-0.07937849999999999,,0,0
ChIJrd2c-TYBdkgRNUkHzzKtW-8,Spurgeon's College,"The Principals Lodge, 189 S Norwood Hill, London SE25 6DJ, United Kingdom",51.4063843,-0.0864566,,4.2,0
ChIJybPBsEMBdkgRZyVINE90PG8,MYC International Limited,"Miller House, Anerley Vale, Upper Norwood SE19 2AQ, United Kingdom",51.416869,-0.0735229,,5,0
ChIJ21PswXcDdkgR5lYvv-nCR7k,"University of the Arts London, Camberwell College of Arts","45-65 Peckham Rd, London SE5 8UF, United Kingdom",51.4742989,-0.080359,,3.5,0
ChIJ____e14CdkgR9flYkFhTQhQ,Lewisham College,"Lewisham Way, London SE4 1UT, United Kingdom",51.4678531,-0.0264382,,4,0
ChIJkTO1ma0BdkgRsCQjpCqAWMY,First Class Learning Crystal Palace,"Harris City Academy, Maberley Rd, London SE19 2JH, United Kingdom",51.41148949999999,-0.074984,,0,0
ChIJz9IbH_gCdkgR-NcAI13_LOs,"Goldsmiths, University of London","8 Lewisham Way, London SE14 6NW, United Kingdom",51.47427099999999,-0.035408,,3.9,0
ChIJl5zFxkABdkgRgxoEExM3Q0Y,Helen O'Grady Drama Academy Upper Norwood,"Harris City Academy, Crystal Palace, Maberley Road, Upper Norwood SE19 2JH, United Kingdom",51.41146699999999,-0.074975,,4,0
ChIJdzBMYFcDdkgRkUihc3QNhd4,London School of Commerce (LSC),"Chaucer House, White Hart Yard, London SE1 1NX, United Kingdom",51.5044403,-0.0897861,,3.8,0
ChIJy0jDMYcEdkgRQ8FESQGZ-lo,Brooke Hall,"17 Flodden Rd, London SE5 9LH, United Kingdom",51.4748527,-0.1000891,,3.3,0
ChIJl7h6nIEDdkgREroa_o8zMqw,Kings College London,"De Crespigny Park, London SE5 8AB, United Kingdom",51.4703257,-0.08983170000000001,,0,0
ChIJBaPhoYEDdkgRDWoMU8nKWi8,IOPPN,"16 De Crespigny Park, London SE5 8AB, United Kingdom",51.4701347,-0.0895309,,4.6,0
ChIJa3eTmGIDdkgR8kqfAFN4aOs,University Of Suya,"1 Arnside St, London SE17 2EY, United Kingdom",51.4848258,-0.09334579999999999,,5,0
ChIJT_vV7XcDdkgR5QFA83_EiW8,Aytun Vocational College London,"f, The Residence SE5, 41 Peckham Rd, London SE5 9HY, United Kingdom",51.4739163,-0.08116419999999999,,0,0
ChIJp_KBRX4DdkgRJ4phdl4LDSc,Orchard Hill College,"Lomond House, 50 Camberwell Green, London SE5 7AL, United Kingdom",51.4763394,-0.0917413,,4,0
ChIJnylOZn4DdkgRLq4W0T84BQw,Aytun Vocational College London,"Unit F6, Lilford Business Centre, 61 Lilford Rd, Vassal, London SE5 9HY, United Kingdom",51.47054499999999,-0.102126,,1,0
ChIJRVeknoEDdkgRNKB6-5WcuYo,King's Clinical Trials Unit,"Institute of Psychiatry, David Goldberg Centre for Health Services Research, 16 De Crespigny Park, London SE5 8AF, United Kingdom",51.4705829,-0.08890229999999999,,5,0
ChIJUWxFaugEdkgRpbKNJFnW-mk,Chelsea College of Art & Design,"16 John Islip St, London SW1P 4JU, United Kingdom",51.4902364,-0.1284159,,4,0
ChIJicbKo2QFdkgRY7MRFPaqyeQ,Morley College London - Chelsea Centre,"Hortensia Rd, London SW10 0QS, United Kingdom",51.48181599999999,-0.1854059,,4,0
ChIJAQBQt3QPdkgRJn6Eq-F6pmA,Clark University,"Riverbank house, room 701 One, Putney Bridge Approach, London SW6 3JD, United Kingdom",51.468554,-0.2105642,,0,0
ChIJDxuvZywbdkgRYZCqubh-D1I,The Summer Fashion School London,"King's Rd, London SW3 5UB, United Kingdom",51.48670019999999,-0.1707755,,5,0
ChIJAQoi2mcFdkgRhi5pHDcbkTE,Imperial College London,"Exhibition Rd, South Kensington, London SW7 2BX, United Kingdom",51.49882220000001,-0.1748735,,4.5,0
ChIJJeMPWCEFdkgRHhGT-l0KsB8,Weeks Building,"16-18 Prince's Gardens, London SW7 1NE, United Kingdom",51.5001354,-0.171944,,0,0
ChIJI5PqeGcFdkgRj4mWfstDmK8,Mander Portman Woodward,"90-92 Queen's Gate, South Kensington, London SW7 5AB, United Kingdom",51.4934735,-0.1789126,,3.9,0
ChIJj-rxgFwFdkgR5s0oEiL5LpM,"Imperial College London, South Kensington Campus","Huxley Building, 180 Queen's Gate, South Kensington, London SW7 2AZ, United Kingdom",51.4987112,-0.1794271,,4.6,0
ChIJ1eVLPmAFdkgRsmD1jGImZrg,Ithaca College,"35 Harrington Gardens, London SW7 4JU, United Kingdom",51.4927694,-0.1845075,,0,0
ChIJGyN1O0AFdkgR6BYEsP5Vgzw,Concise Courses Limited,"61 Walton St, London SW3 2JX, United Kingdom",51.4947495,-0.1667418,,0,0
ChIJD8_mb0obdkgRaRksHsyqp5c,Uk College,"Red Lion St, London WC1R 4NA, United Kingdom",51.5183452,-0.1170669,,4,0
ChIJyfDOSvYPdkgRspdMrvxiS74,Richmond The American International University in London,"37 Kensington High St, London W8 5ED, United Kingdom",51.5012721,-0.1898751,,0,0
ChIJ8UPTnEQFdkgR4M6il0YSmjA,"Imperial College London, 53 Prince's Gate","London SW7 2PG, United Kingdom",51.4992963,-0.1739908,,0,0
ChIJO52ag0QFdkgRxzfl9L8Ruhg,Pepperdine University,"56 Princes Gate, London SW7 2PG, United Kingdom",51.4990067,-0.1739002,,4.8,0
ChIJ-RweG9UadkgRBqsmw6hEdcw,University of Westminster,"309 Regent St., London W1B 2HW, United Kingdom",51.5169425,-0.1432732,,4.2,0
ChIJVV3mX3EFdkgRgDqcWt1jvOQ,RCA Battersea,"Riverside, 1 Hester Rd, London SW11 4AN, United Kingdom",51.4793797,-0.1702443,,4.4,0
ChIJeTUXaS8bdkgRPhPMrn_GCNA,University College London,"Gower St, London WC1E 6BT, United Kingdom",51.52455920000001,-0.1340401,,4.5,0
ChIJHWzEJjoFdkgRLk4cJHCR-6I,St Joseph Christian College London,"100 Stewart's Rd, Nine Elms, London SW8 4UG, United Kingdom",51.4743843,-0.139913,,0,0
ChIJr1uHeGEPdkgRuXOxu5DhGpE,South Thames College,"Wandsworth High St, London SW18 2PP, United Kingdom",51.4566562,-0.1905644,,3.8,0
ChIJx3GEu3sFdkgRopkeI1_MXvk,Westminster University,"London SW1P 4QA, United Kingdom",51.4895967,-0.1296858,,5,0
ChIJDYIgr-0EdkgR7-gNPiaN6kI,College of English,"London SW8 1TA, United Kingdom",51.4855489,-0.1207022,,0,0
ChIJHZfEofIbdkgRUzGnFZcAA9A,University of London,"University of London - University College London, London WC1H 0PY, United Kingdom",51.524525,-0.1293938,,5,0
ChIJUfwr9fwadkgRUfcp3anIoMM,Westminster Kingsway College - King's Cross Centre,"211 Grays Inn Rd, London WC1X 8RA, United Kingdom",51.526947,-0.1186528,,3.5,0
ChIJg3zecbcEdkgRp6-td5L1aB8,"King's College London, Waterloo Bridge Wing, Franklin Wilkins Building","Franklin-Wilkins Building (Waterloo Bridge wing), Franklin-Wilkins Building, Stamford St, London SE1 9NH, United Kingdom",51.5055503,-0.1135949,,5,0
ChIJoYT6BS4bdkgREPtlMwoMcec,University of London Worldwide,"32 Russell Square, London WC1B 5DN, United Kingdom",51.5210964,-0.1275045,,3.7,0
ChIJI_5texyo2EcR4qykpgxMHsM,Ravensbourne University London,"6 Penrose Way, London SE10 0EW, United Kingdom",51.5017355,0.0055388,,3.9,0
ChIJUTPYsaccdkgRgyqyCsIZDVc,"City, University of London","Northampton Square, London EC1V 0HB, United Kingdom",51.5279719,-0.1024624,,4.3,0
ChIJWwWza3sadkgR77gsD5ccs70,London School of Economics and Political Science,"Houghton St, London WC2A 2AE, United Kingdom",51.5144388,-0.1164513,,4.5,0
ChIJ4cuwxPSm2EcRHI1DqTm92x4,London College of Professional Studies,"The Hub, 123 Star Ln E16 4PZ, United Kingdom",51.5197504,0.0115272,,4.7,0
ChIJ3UC7Ti8ddkgRGQUSM96nzMA,Queen Mary University of London,"Mile End Rd, Bethnal Green, London E1 4NS, United Kingdom",51.5240671,-0.0403745,,4.4,0
ChIJV4asCIsQdkgRfeJZc5UbJMY,Middlesex University London,"The Burroughs, London NW4 4BT, United Kingdom",51.5897112,-0.2293488,,4.1,0
ChIJAWELl8scdkgRo6yzRTXipgQ,The College Of Central London,"46-48 E Smithfield, London E1W 1AW, United Kingdom",51.5088464,-0.06931899999999999,,4.9,0
ChIJHWpePY0CdkgRXTLKUKifieQ,Bellerbys College London,"Bounty House, Stowage, London SE8 3DE, United Kingdom",51.4817132,-0.0218402,,3.8,0
ChIJ3VW0o7UEdkgRjZLQfvs-ZLA,King's College London,"Strand, London WC2R 2LS, United Kingdom",51.5114864,-0.115997,,4.3,0
ChIJjW_mTL4PdkgRwaOpol2OdXs,West London College,"9 Gliddon Rd, London W14 9BL, United Kingdom",51.4909474,-0.2136977,,3.5,0
ChIJV10YI-qm2EcRBiOR1AvqbUQ,UKCBC,"350 Eastern Ave, Gants Hill, Ilford IG2 6NW, United Kingdom",51.576376,0.06112020000000001,,3.2,0
ChIJKb8wNtYadkgRV8h5WPCfzoM,London College of Fashion,"20 John Prince's St, London W1G 0BJ, United Kingdom",51.5154992,-0.1436318,,4.2,0
ChIJ1TUjujUbdkgR5Rd30q8j7yY,University of the Arts London,"272 High Holborn, London WC1V 7EY, United Kingdom",51.5178589,-0.1165507,,4,0
ChIJ4X8b58sEdkgRGd14UEQMtdI,Pearson College London,"190 High Holborn, London WC1V 7BH, United Kingdom",51.516725,-0.1232653,,4.1,0
ChIJ_V1cA_MNdkgROBTyzDQjL0I,University of West London,"St Mary's Rd, London W5 5RF, United Kingdom",51.5068853,-0.3032026,,4.1,0
ChIJ-QN5fmEEdkgR3JzmyV33HsA,Universal College,"24 William IV St, London WC2N 4DL, United Kingdom",51.5092691,-0.1264344,,0,0
ChIJcWGP2BwNdkgRJO5BEP165uI,West Thames College,"West Thames College, London Rd, Isleworth TW7 4HS, United Kingdom",51.4751651,-0.3418236,,3.5,0
ChIJQ2viD6kRdkgRqypic9UubZM,College of North West London,"Denzil Rd, Dudden Hill Ln, London NW10 2XD, United Kingdom",51.5511845,-0.2434556,,3.5,0
ChIJbcZkic8QdkgRbrbnp7MXZ0Q,Brampton College,"Lodge House, Lodge Rd, London NW4 4DQ, United Kingdom",51.58863280000001,-0.222164,,4.1,0
ChIJM8PHBFsFdkgRFJMllTutvtg,Royal College of Art,"Kensington Gore, South Kensington, London SW7 2EU, United Kingdom",51.5011441,-0.1792847,,4.3,0
ChIJ_6FFYPoDdkgRYicYagyfDZ8,Dulwich College,"Dulwich Common, London SE21 7LD, United Kingdom",51.44014869999999,-0.085841,,4.2,0
ChIJ65bFzigDdkgRt_pCxYB81iI,Perform SE21 Dulwich,"Francis Peek Community Room College Road, Dulwich Park, London SE21 7BQ, United Kingdom",51.447267,-0.083091,,0,0
ChIJITQY2BYDdkgRY9mnRckZ3vw,Perform Dulwich,"St Stephen's Millennium Hall, College Rd SE21 7HW, United Kingdom",51.43260859999999,-0.0784216,,0,0
ChIJBycuHDEddkgRqTRf6TGakkg,University of Cumbria in London,"58 E India Dock Rd, London E14 6JE, United Kingdom",51.5109935,-0.0244699,,4.9,0
ChIJv89DSY0DdkgR0glBaq32l84,Perform Dulwich,"St. Barnabas Church Hall, 40 Calton Ave, London SE21 7DG, United Kingdom",51.4528752,-0.08241,,0,0
ChIJx2V7MPgCdkgRLE43VQfioCg,"Warmington Tower, Goldsmiths, University of London","10 Dixon Rd, London SE14 5PZ, United Kingdom",51.4747687,-0.0358474,,0,0
ChIJuWGtjveq2EcR6tNoNncS4JY,London South East Colleges: Bromley,"Rookery Ln, Bromley BR2 8HE, United Kingdom",51.3870452,0.0348461,,3.9,0
ChIJjTtnR_wBdkgR0mP73Hou-rI,D&B Academy of Performing Arts,"470 Bromley Rd, Bromley BR1 4PP, United Kingdom",51.424074,-0.003937,,3.6,0
ChIJIzVESoQCdkgRCkNlixKBUZ8,University of Greenwich,"Old Royal Naval College, Park Row, London SE10 9LS, United Kingdom",51.4829866,-0.0063883,,4.5,0
ChIJ6TKW15uo2EcR0CZiTHPuodI,University of East London,"University Way, London E16 2RD, United Kingdom",51.5076234,0.0650647,,4,0
ChIJRQ0alvKq2EcRZnuMJbCrSTk,Stagecoach Performing Arts Bromley,"Parish CE Primary School, London Ln, Bromley BR1 4HF, United Kingdom",51.4150595,0.0140522,,5,0
ChIJ0aNXQwuq2EcRBWoi29in_7o,PHaseltine Area Fjutr,"8 Al.derton Cres, NW4 3XT London, London, , NW4 3XT, London NW4 3XT, United Kingdom",51.4109553,0.005074,,5,0
ChIJbdgmYE-q2EcR3Iz56VIEyw4,Perform Bromley St George's,"St Georges C E Primary School/Tylney Rd, Bromley BR1 2RL, United Kingdom",51.4041074,0.0347476,,0,0
ChIJXdNi1EWp2EcRGG0qZmsot2M,University of Greenwich Southwood Site,"Southwood Site, Avery Hill Rd, London SE9 2UG, United Kingdom",51.44565309999999,0.0799373,,4.5,0
ChIJUXcRpE2q2EcR27qQce4pK4M,Vibe Arts Bromley,"Bickley Park School, 24 Page Heath Ln, Bromley BR1 2DS, United Kingdom",51.4011514,0.0433978,,5,0
ChIJBT-5kAWr2EcRNUc2B2XTef4,Perform Bromley,"St John The Evangelist Church, Park Rd, Bromley BR1 3HJ, United Kingdom",51.40876799999999,0.023166,,0,0
ChIJJ03wrVcDdkgRJgvqbiGZRas,"Anglia Ruskin University, London - East India Building","3rd Floor, Import Building, 2 Clove Cres, London E14 2BE, United Kingdom",51.5100384,-0.0048359,,4.9,0
ChIJl_DZTYYBdkgRuzKp4a7UO34,TYRANNUS BIBLE COLLEGE,"10 Bell Green Ln, London SE26 5TW, United Kingdom",51.42799189999999,-0.0373322,,0,0
ChIJAR8Mp1Gq2EcRDMbjgk9kKMc,Lafour Dance & Drama Schools,"40 Baths Rd, Bromley BR2 9RB, United Kingdom",51.396939,0.038918,,0,0
ChIJ90HCdKWu2EcR0oS1emtmaEo,Rose Bruford,"Burnt Oak Ln, Sidcup, Kent DA15 9DF, United Kingdom",51.4388016,0.1076975,,4.2,0
ChIJ8d6cMPgCdkgR9Eg5df4mMGM,"Rutherford Information Services Building, Goldsmith's College","10 Dixon Rd, London SE14 5PZ, United Kingdom",51.4750786,-0.0357668,,0,0
ChIJf3WE_kUEdkgRnG-ky-SVuS0,Perform,"Kings Avenue School, Kings Ave, London SW4 8BQ, United Kingdom",51.4570583,-0.1299446,,0,0
ChIJfyPmVcsFdkgRmWggK8o-LuM,Michael Tippett College,"Belthorn Cres, Weir Rd, London SW12 0NS, United Kingdom",51.4466908,-0.1408775,,5,0
ChIJFxGFiE0EdkgRZJPubcQqwW8,enjoy italian,"Clapham High St, London SW4 7SS, United Kingdom",51.4620974,-0.1368014,,0,0
ChIJl-m9nE4EdkgR5JLGOpMFfdk,Kumon Maths & English,"West Indian Association of Service Personnel - WASP HQ, 161-167 Clapham Manor St, London SW4 6DB, United Kingdom",51.463838,-0.1346893,,5,0
ChIJQ4CWwFkEdkgR8ySK6J36yOQ,Brazilian Trade Link Ltd,"18 Union Rd, London SW4 6JP, United Kingdom",51.4692769,-0.1276392,,0,0
ChIJFQCoUlMEdkgRVSs_4EgDUYg,Perform Clapham,"Clapham Manor Primary School, Belmont Rd, London SW4 0BZ, United Kingdom",51.4647091,-0.1378642,,5,0
ChIJE_APdE0EdkgR-rNQCiqAJy8,The British Photography Awards,"The Prudential Building, London SW4 7AA, United Kingdom",51.461355,-0.138085,,5,0
ChIJIRVcBGcFdkgRac20Xx3DwN8,Perform Herne Hill,"Kids London Ltd, Kids London Studio, 67 Dulwich Rd, London SE24 0NJ, United Kingdom",51.45382439999999,-0.1065776,,0,0
ChIJASawzYADdkgR5DFqUZFf40s,Academic Neurosciences Centre,"Denmark Hill Campus, Weston Education Centre, 10 Cutcombe Rd, London SE5 9RJ, United Kingdom",51.467927,-0.0918488,,5,0
ChIJCxH_YG0EdkgRlrNAt0OCRGM,Dental Nursing,"MA Healthcare Ltd, St Jude's Church, Dulwich Rd, London SE24 0PB, United Kingdom",51.4540848,-0.1086178,,0,0
ChIJ75dvF3MEdkgRlh4Sok5KLqw,Creative Minds London,"278 Milkwood Rd, London SE24 0EZ, United Kingdom",51.4534265,-0.1017938,,5,0
ChIJh17bqYYDdkgRPKgoLLZUC1M,William Booth College,"William Booth College, Champion Park, London SE5 8BQ, United Kingdom",51.4674567,-0.0887003,,4.4,1
ChIJm_c9M38EdkgR8NIEc7a9HwM,Cicely Saunders Institute,"Bessemer Rd, London SE5 9RS, United Kingdom",51.4682697,-0.0961345,,5,0
ChIJ7wscuI4DdkgR5Y6pdA-_YbA,Stagecoach Performing Arts Dulwich,"Bessemer Grange Primary School, Nairne Grove, London SE5 8HP, United Kingdom",51.458818,-0.086903,,5,0
ChIJUQ5xXesGdkgRcSAALcWjEL0,Stanford College UK,"1393A London Rd, Norbury, London SW16 4AN, United Kingdom",51.4085098,-0.122274,,1,0
ChIJbW8lCZ0GdkgRzkPACA7MSOE,London Corporate College,"16 Wellfield Rd, London SW16 2BP, United Kingdom",51.4291474,-0.1261736,,0,0
ChIJc9VmdIMGdkgR5EaATUPX79c,City School Ltd,"342 Streatham High Rd, London SW16 6HH, United Kingdom",51.4267581,-0.1315103,,0,0
ChIJjxEKep0GdkgR6KSZaP-1S8E,Brixton Training Centre,"39 Sunnyhill Rd, London SW16 2UG, United Kingdom",51.4305168,-0.127199,,0,0
ChIJzy-KYRgHdkgRmvi6btswYP8,Anglia Ruskin University London,"3rd Floor, Import Building, Clove Cres, London E14 2BE, United Kingdom",51.4175396,-0.178734,,0,0
ChIJcZjGyc4OdkgRJFPQfnUqGCM,Kingston University London Roehampton Vale Campus,"Friars Ave, London SW15 3DW, United Kingdom",51.4373491,-0.2517305,,4.7,0
ChIJNbp7QtUFdkgRPciISScbxnE,Lambeth College,"56 brixton hill sw2 1qs, United Kingdom",51.43657109999999,-0.1609703,,0,0
ChIJ19N1wwsGdkgRmWinbz8uRf8,South Thames College,"71 Tooting High St, London SW17 0TQ, United Kingdom",51.4271736,-0.1680548,,4.2,0
ChIJf5MynMAIdkgR19pxGyUJ-DE,Wimbledon College of Arts,"Merton Hall Rd, London SW19 3QA, United Kingdom",51.4133937,-0.211503,,4.5,0
ChIJzR515T4GdkgRlopcumLQgxE,CAXTON COLLEGE OF EDUCATION,"Unit 4, 37-39 Western Rd, Mitcham CR4 3ED, United Kingdom",51.4064324,-0.1674392,,0,0
ChIJ8x9Yy_Om2EcRfsfic4BpYP8,EThames Graduate School,"112 Morden Rd, Merton, London SW19 3BP, United Kingdom",51.4100668,-0.1927349,,4.4,0
ChIJr1uHeGEPdkgRVBZwvouVjRQ,Merton College,"Merton College, London Rd, Morden SM4 5QX, United Kingdom",51.3934098,-0.2043265,,3.3,0
ChIJ94xYQzMHdkgR9fEtPfAbK7Q,Croydon College,"College Rd, London CR9 1DX, United Kingdom",51.3737126,-0.09510099999999999,,3.8,0
ChIJ60LCwOYOdkgRvyt1gc5lVjo,University of Roehampton London,"Roehampton Ln, London SW15 5PU, United Kingdom",51.45812489999999,-0.2444674,,4.4,0
ChIJVRdI2x8GdkgRSR3breVz2Zs,Manchester International Training College,"Dalton House, 60 Windsor Ave, London SW19 2RR, United Kingdom",51.4115337,-0.1866603,,0,0
ChIJscoW78AHdkgRmSyH2GCzwhw,Carshalton College,"Nightingale Rd, Carshalton SM5 2EJ, United Kingdom",51.37185239999999,-0.1652401,,4,0
ChIJvQlkJa0FdkgR9tQ0TpPdevQ,City College Stratford - Brixton,"unit 3, Warwick House, Overton Rd, London SW9 7JP, United Kingdom",51.4686998,-0.1115146,,4.8,0
ChIJmTawNGgEdkgR968dvXLQwbk,School of Communication Arts,"49 Brixton Station Rd, London SW9 8PQ, United Kingdom",51.4635088,-0.1123713,,5,0
ChIJNWHJ4l4EdkgRekXPLnY0X8g,King George's House,"King Georges House, 40 Stockwell Rd, London SW9 9ES, United Kingdom",51.4702595,-0.1207574,,1,0
ChIJ5X72tLoEdkgRLDjhg_eCi-I,Southwark College,"25 The Cut, London SE1 8LF, United Kingdom",51.50333939999999,-0.1058718,,4.3,0
ChIJBS8tKT8bdkgRPX-xl5zR6Vg,BPP University London Waterloo,"137 Stamford St, London SE1 9NN, United Kingdom",51.5051536,-0.1124391,,4,0
ChIJl4WB6l4DdkgR5FdWW_gnyas,King's College London,"Newcomen St, London SE1 1UL, United Kingdom",51.5038244,-0.0894519,,4.6,0
ChIJk0fKALEFdkgRhZJliNh8Dmc,London School of Science and Technology (E&C),"Lancaster House, 70 Newington Causeway, London SE1 6DF, United Kingdom",51.4974425,-0.0993618,,4.1,0
ChIJc1khbt0DdkgRxkgWXcho0_E,University,"Kings College London, 18-20 Newcomen St, London SE1 1UL, United Kingdom",51.5028027,-0.089631,,0,0
ChIJh9PuXFgDdkgRVozOEtf3hQM,Kaplan London Bridge,"179-191 Borough High St, London SE1 1HR, United Kingdom",51.5023141,-0.09216049999999999,,2.9,0
ChIJLd8LbkQDdkgRgmRz_cdjH9U,London College Of Social Studies,"1-4 Pope St, London SE1 3PR, United Kingdom",51.4997797,-0.07829459999999999,,1,0
ChIJG9shlcIDdkgRgRb7Px3AwR8,"City, University of London","Northampton Square, London EC1V, United Kingdom",51.5011368,-0.0875316,,0,0
ChIJJSgM61gDdkgRCGZlyj3yYPE,Anglia Ruskin University London,"200 Great Dover St, London SE1 4YB, United Kingdom",51.5007438,-0.09226419999999999,,0,0
ChIJn3V6WNIadkgR2b_QadKkyzw,DLD College London,"199 Westminster Bridge Rd, London SE1 7FX, United Kingdom",51.5002079,-0.116104,,3.5,0
ChIJtwYKMQIFdkgRW861sQqZ7Z0,Kumon Maths & English,"West Norwood Health and Leisure Centre, 25 Devane Way, Norwood SE27 0DF, United Kingdom",51.4327614,-0.105966,,0,0
ChIJ8aZz_wQEdkgRDarTUybYvqc,The Pauline Quirke Academy of Performing Arts Dulwich,"The Elmgreen School, Elmcourt Rd, London SE27 9BZ, United Kingdom",51.43904819999999,-0.102733,,0,0
ChIJFQM1PZxbK2cRxd2fgb4fJcI,browstastic by siri,"515 Norwood Rd, Norwood, London SE27 9DL, United Kingdom",51.4349831,-0.1037241,,5,0
ChIJQ_tXjNMFdkgRvlDl4dCCTMk,Buzzhire,"46 Lovelace Rd, Norwood, London SE21 8JR, United Kingdom",51.44030739999999,-0.09924089999999999,,0,0
ChIJdx0dK6wGdkgR5CwLtiUbmhw,Stagecoach Performing Arts Upper Norwood,"The Norwood School, Crown Dl, Norwood, London SE19 3NY, United Kingdom",51.423158,-0.0992868,,0,0
ChIJZZGtOq0GdkgRW13drumohdY,Schools Plus at Virgo Fidelis,"Virgo Fidelis School, 147 Central Hill, London SE19 1RS, United Kingdom",51.422376,-0.09439499999999999,,0,0
ChIJ-2YFa8UFdkgR2tZCf1-jTXQ,Mid Career College,"222 Balham High Rd, London SW12 9BS, United Kingdom",51.4420878,-0.1545159,,0,0
ChIJpc13zckFdkgR2XG8bQhS03Y,Perform Within St Francis Xavier College,"St Francis Xavier College, 10 Malwood Rd, London SW12 8EN, United Kingdom",51.4521142,-0.1495594,,0,0
ChIJz21AUsQFdkgR_OwCLjbjDs8,Jigsaw Performing Arts School Balham,"Chestnut Grove School, Boundaries Road, Balham SW12 8JZ, United Kingdom",51.44454899999999,-0.155554,,5,0
